{
  "$schema": "https://json-schema.org/draft/2020-12/schema",
  "$id": "https://appsec-advisor/schemas/fragments/data-flows.schema.json",
  "title": "Phase 3 sidecar — persisted data flows",
  "type": "object",
  "additionalProperties": false,
  "required": ["schema_version", "component_inventory_fingerprint", "data_flows"],
  "properties": {
    "schema_version": {"const": 1},
    "component_inventory_fingerprint": {
      "type": "string",
      "pattern": "^sha256:[0-9a-f]{64}$"
    },
    "external_entities": {
      "type": "array",
      "maxItems": 64,
      "items": {
        "type": "object",
        "additionalProperties": false,
        "required": [
          "id",
          "name",
          "kind",
          "description",
          "evidence"
        ],
        "dependentSchemas": {"access": {"properties": {"kind": {"const": "legitimate-role"}}}},
        "properties": {
          "id": {
            "type": "string",
            "pattern": "^ext-[a-z0-9]+(?:-[a-z0-9]+)*$",
            "maxLength": 100
          },
          "name": {
            "type": "string",
            "minLength": 1,
            "maxLength": 80
          },
          "kind": {
            "type": "string",
            "enum": [
              "legitimate-role",
              "identity-provider",
              "external-service"
            ]
          },
          "access": {"type": "string", "enum": ["internet-anon", "internet-user", "internet-priv-user"]},
          "description": {
            "type": "string",
            "minLength": 1,
            "maxLength": 240
          },
          "evidence": {
            "type": "array",
            "minItems": 1,
            "maxItems": 8,
            "items": {
              "type": "object",
              "additionalProperties": false,
              "required": [
                "file",
                "line"
              ],
              "properties": {
                "file": {
                  "type": "string",
                  "minLength": 1,
                  "maxLength": 512,
                  "not": {
                    "pattern": "^(?:/|[A-Za-z]:[\\\\/]|[A-Za-z][A-Za-z0-9+.-]*://)|(?:^|/)\\.\\.(?:/|$)|\\\\"
                  }
                },
                "line": {
                  "type": "integer",
                  "minimum": 1
                }
              }
            }
          }
        }
      }
    },
    "data_flows": {
      "type": "array",
      "maxItems": 500,
      "items": {"$ref": "#/$defs/data_flow"}
    }
  },
  "$defs": {
    "endpoint": {
      "type": "string",
      "pattern": "^(?:external|[a-z][a-z0-9-]+)$",
      "maxLength": 128
    },
    "evidence": {
      "type": "object",
      "additionalProperties": false,
      "required": ["file"],
      "properties": {
        "file": {
          "type": "string",
          "minLength": 1,
          "maxLength": 512,
          "description": "Canonical repository-relative path to an existing contained regular file, validated at the producer and architecture-stage gates.",
          "not": {
            "pattern": "^(?:/|[A-Za-z]:[\\\\/]|[a-zA-Z][a-zA-Z0-9+.-]*://)|(?:^|/)\\.\\.(?:/|$)"
          }
        },
        "line": {"type": "integer", "minimum": 1, "description": "Existing one-based line in the evidence file."}
      }
    },
    "data_flow": {
      "type": "object",
      "additionalProperties": false,
      "required": [
        "id",
        "from",
        "to",
        "label",
        "protocol",
        "data_classification",
        "direction",
        "evidence",
        "provenance"
      ],
      "properties": {
        "id": {"type": "string", "pattern": "^df-[0-9]{3,}$"},
        "from": {"$ref": "#/$defs/endpoint"},
        "to": {"$ref": "#/$defs/endpoint"},
        "from_entity": {"type": "string", "pattern": "^ext-[a-z0-9]+(?:-[a-z0-9]+)*$", "maxLength": 100},
        "to_entity": {"type": "string", "pattern": "^ext-[a-z0-9]+(?:-[a-z0-9]+)*$", "maxLength": 100},
        "label": {"type": "string", "minLength": 1, "maxLength": 120},
        "diagram_label": {
          "type": "string", "minLength": 1, "maxLength": 48, "pattern": "^[^\\r\\n\\t]+$",
          "description": "Short plain-text purpose or payload for Figure 1, preserving authentication or direction distinctions. Omit repeated endpoint names and protocol. The full label remains authoritative; optional for older inventories."
        },
        "protocol": {"type": "string", "minLength": 1, "maxLength": 80},
        "authentication": {
          "type": "object", "additionalProperties": false,
          "required": ["scheme","scope","evidence"],
          "properties": {
            "scheme": {"type":"string","enum":["unknown","none","password","basic","bearer","cookie","api-key","oauth2","oidc","saml","mtls","private-key","mfa","other"]},
            "scope": {"type":"string","minLength":1,"maxLength":240,"pattern":"^[^\\r\\n\\t]+$"},
            "transport": {"type":"string","enum":["protected","cleartext","unknown"]},
            "flow": {"type":"string","enum":["implicit","authorization-code","authorization-code-pkce","client-credentials","device-code"]},
            "factors": {"type":"array","minItems":2,"maxItems":4,"uniqueItems":true,"items":{"type":"string","enum":["password","totp","webauthn","hardware-key","push","sms","email","biometric"]}},
            "evidence": {"type":"array","minItems":1,"maxItems":8,"items":{"type":"object","additionalProperties":false,"required":["file","line"],"properties":{"file":{"type":"string","minLength":1,"maxLength":512,"not":{"pattern":"^(?:/|[A-Za-z]:[\\\\/]|[A-Za-z][A-Za-z0-9+.-]*://)|(?:^|/)\\.\\.(?:/|$)|\\\\"}},"line":{"type":"integer","minimum":1}}}}
          },
          "allOf": [{"if":{"properties":{"scheme":{"const":"mfa"}}},"then":{"required":["factors"],"properties":{"factors":{"contains":{"enum":["password","biometric"]}}}},"else":{"not":{"required":["factors"]}}},{"if":{"required":["flow"]},"then":{"properties":{"scheme":{"enum":["oauth2","oidc"]}}}}]
        },
        "access_group": {
          "type": "object", "additionalProperties": false,
          "required": ["id", "mode", "label"],
          "properties": {
            "id": {"type": "string", "pattern": "^[a-z][a-z0-9-]*$", "maxLength": 80},
            "mode": {"type": "string", "enum": ["alternatives", "sequence"]},
            "label": {"type": "string", "minLength": 1, "maxLength": 48, "pattern": "^[^\\r\\n\\t]+$"},
            "step": {"type": "integer", "minimum": 1, "maximum": 500}
          },
          "allOf": [{"if": {"properties": {"mode": {"const": "sequence"}}}, "then": {"required": ["step"]}, "else": {"not": {"required": ["step"]}}}]
        },
        "interaction": {"type": "boolean", "description": "Human interaction with a client, not a technical API request."},
        "protocol_group": {"type": "string", "minLength": 1, "maxLength": 80, "description": "Evidenced multi-step integration; may use endpoint references in the overview."},
        "data_classification": {"type": "string", "minLength": 1, "maxLength": 80},
        "direction": {
          "type": "string",
          "enum": ["unidirectional", "bidirectional", "request-response"]
        },
        "evidence": {
          "type": "array",
          "maxItems": 8,
          "items": {"$ref": "#/$defs/evidence"}
        },
        "route_refs": {
          "type": "array",
          "maxItems": 32,
          "uniqueItems": true,
          "items": {"type": "string", "minLength": 1, "maxLength": 120}
        },
        "interface_refs": {
          "type": "array",
          "maxItems": 32,
          "uniqueItems": true,
          "items": {"type": "string", "minLength": 1, "maxLength": 120}
        },
        "provenance": {
          "type": "string",
          "enum": ["recon", "architecture", "route-extraction", "repo-declared"]
        },
        "threats": {
          "type": "array",
          "uniqueItems": true,
          "items": {"type": "string", "pattern": "^T-[0-9]{3,}$"}
        }
      }
    }
  }
}
